link,name
https://shop.wegmans.com/recipes/3134/basil-garlic-sauce,Basil & Garlic Sauce,Wegmans Garlic, Peeled, Wegmans Italian Classics Campagnan Extra Virgin Olive Oil, Lemons
https://shop.wegmans.com/recipes/2349/basil-pesto-pane,Basil Pesto Pane,Wegmans Pane Italian Bread, Wegmans Italian Classics Basil Pesto Sauce
https://shop.wegmans.com/recipes/4036/bbq-bacon,BBQ Bacon,Wegmans Brown Sugar BBQ Sauce, Wegmans Uncured Bacon, Applewood Smoked
https://shop.wegmans.com/recipes/895/bbq-portabella-cutlet-sandwich,BBQ Portabella Cutlet Sandwich,Avocado, Wegmans Olive Oil Cooking Spray, Wegmans BBQ Seasoning Shakr, Wegmans Fresh Cut  Portabella Mushroom Cutlets, Wegmans Black Pepper, Pure Ground , Wegmans Multi Grain Rolls, 8 Rolls, Green Leaf Lettuce, Wegmans Ranch Yogurt Dressing, Beefsteak Tomatoes
https://shop.wegmans.com/recipes/1393/bbq-turkey-with-cheddar,BBQ Turkey with Cheddar,Wegmans 16-18 Month Aged White Cheddar Cheese- Medium, Wegmans Organic Oven Roasted Turkey Breast, Wegmans Uncured Bacon, Applewood Smoked, Wegmans Memphis Style BBQ Sauce, Wegmans Kosher Dill
https://shop.wegmans.com/recipes/4136/beef-barley-soup,Beef Barley Soup,Wegmans Diced Mirepoix, Wegmans Beef Culinary Stock, Wegmans Coarse Ground Steam Peeled Tomatoes, Wegmans Thyme, Wegmans Boneless Beef Short Ribs, Wegmans 100% Mediterranean Blend Olive Oil, Pure, Organic Pearled Barley, Wegmans Italian Parsley
https://shop.wegmans.com/recipes/3475/beef-braciola,Beef Braciola,Wegmans 100% Mediterranean Blend Olive Oil, Pure, Wegmans Italian Classics Pecorino Romano Cheese -Shredded, Wegmans 80/20 Ground Beef, Wegmans Golden Raisins, Wegmans Top Round Cutlets, Boneless, Wegmans Seasoned Bread Crumbs, Wegmans Pan Searing Flour, DELLALO Pine Nuts, Spanish, Wegmans One Dozen Large Eggs, Italian Parsley, Wegmans Italian Classics Grandmas Pomodoro Sauce, Wegmans Garlic, Peeled
https://shop.wegmans.com/recipes/2651/beef-burgundy,Beef Burgundy,Wegmans Baby Cut Carrots, Wegmans Yellow Cooking Onions, MCCORMICK Bay Leaves, Wegmans Uncured Bacon, Applewood Smoked, Wegmans Beef Culinary Stock, Wegmans Pan Searing Flour, Wegmans Garlic, Peeled, McCormick Gourmet Organic Red Curry Powder, Wegmans Tomato Paste, Wegmans Sliced White Mushrooms, Wegmans Boneless Beef for Stew, Wegmans Vegetable Oil, Pearl Onions
https://shop.wegmans.com/recipes/948/beef-chili,Beef Chili,Wegmans Chopped Onions, FRENCHS Regular Worcestershire Sauce, MCCORMICK Ground Cumin, Wegmans 90/10 Ground Beef, FAMILY PACK, MCCORMICK Chili Powder, Wegmans Diced Green Peppers & Onions, Wegmans Chili Sauce, Wegmans Vegetable Oil, Wegmans Beef Culinary Stock, Wegmans Dark Red Kidney Beans, Wegmans Garlic, Peeled, MCCORMICK Oregano, Leaves, Wegmans Cannellini Beans
https://shop.wegmans.com/recipes/3113/beef-fajitas,Beef Fajitas,Wegmans 100% Mediterranean Blend Olive Oil, Pure, Sole! Cotija Cheese, Wegmans Pepper & Onion Fajita Blend, Wegmans Guajillo Pepper Adobo, Wegmans Fajita Tortilla Gordita Style, FAMILY PACK, Wegmans Roasted Tomato Salsa, Wegmans Roasted Salsa Verde, Medium, Large Fresh Limes, Fresh Cilantro (Corriander)
https://shop.wegmans.com/recipes/3113/beef-fajitas,Beef Fajitas,Wegmans 100% Mediterranean Blend Olive Oil, Pure, Sole! Cotija Cheese, Wegmans Pepper & Onion Fajita Blend, Wegmans Guajillo Pepper Adobo, Wegmans Fajita Tortilla Gordita Style, FAMILY PACK, Wegmans Roasted Tomato Salsa, Wegmans Roasted Salsa Verde, Medium, Large Fresh Limes, Fresh Cilantro (Corriander)
https://shop.wegmans.com/recipes/676/beef-on-crostini,Beef on Crostini,Wegmans Horseradish Cream Sauce, Wegmans Black Angus Seasoned Roast Beef
https://shop.wegmans.com/recipes/2888/beef-ossobuco-red-sauce,Beef Ossobuco (Red Sauce),Wegmans Beef Center Cut Shank, Wegmans Pan Searing Flour, Wegmans Whole White Mushrooms, McCormick Gourmet Organic Red Curry Powder, Wegmans Garlic, Peeled, Wegmans 100% Mediterranean Blend Olive Oil, Pure, Wegmans Beef Culinary Stock, Wegmans Diced Mirepoix, Wegmans Steam Peeled Diced Tomatoes
https://shop.wegmans.com/recipes/1660/beef-sirloin-roast-in-mushroom-wine-sauce,Beef Sirloin Roast in Mushroom Wine Sauce,Wegmans Butter, Salted, Sweet Cream, Wegmans Cracked Pepper Seasoning Shakr, Wegmans Sliced Baby Bella Mushrooms, Wegmans Boneless Beef Sirloin Roast, USDA Choice, Wegmans Tarragon, Wegmans Peeled Shallots, Wegmans Organic Basting Oil, Wegmans Italian Classics Organic Red Wine Vinegar with The Mother, Wegmans Demi-Glace
https://shop.wegmans.com/recipes/3608/beef-stroganoff-with-pasta,Beef Stroganoff with Pasta,Wegmans 100% Mediterranean Blend Olive Oil, Pure, Wegmans Diced Green Peppers & Onions, Wegmans French Onion Dip, Wegmans Italian Classics Mushroom Marsala Simmer Sauce, Wegmans 80/20 Ground Angus Beef, Wegmans Sliced White Mushrooms, Wegmans Italian Classics Cavatappi
https://shop.wegmans.com/recipes/3792/beef-tacos,Beef Tacos,Wegmans Organic Stoneground Yellow Corn Tortillas, Wegmans Guajillo Pepper Adobo, Sole! Queso Fresco Cheese, White Onions, Large Fresh Limes, Wegmans Vegetable Oil, Fresh Cilantro (Corriander), Wegmans Roasted Tomato Salsa
https://shop.wegmans.com/recipes/1920/beef-wellington,Beef Wellington,Wegmans 100% Mediterranean Blend Olive Oil, Pure, Pepperidge Farm Puff Pastry Frozen Sheets Pastry Dough, Wegmans One Dozen Large Eggs, Wegmans Pan Searing Flour, Wegmans Beef Tenderloin Steak, Wegmans All Purpose Unbleached Flour
https://shop.wegmans.com/recipes/3854/beer-cheddar-cheese-soup,Beer Cheddar Cheese Soup,FRENCHS Regular Worcestershire Sauce, Wegmans Garlic, Peeled, Colmans of Norwich Double Superfine Mustard Powder, Original English, Wegmans Horseradish Cream Sauce, Wegmans Butter, Salted, Sweet Cream, Wegmans Heavy Cream, Wegmans Sharp Cheddar Shredded Cheese, Wegmans Chicken Culinary Stock, Wegmans Diced Mirepoix, Wegmans All Purpose Unbleached Flour
https://shop.wegmans.com/recipes/4199/berry-french-toast,Berry French Toast,MCCORMICK Cinnamon, Ground, Wegmans Canola Oil Butter Flavor Cooking Spray, Bananas, Each, Wegmans Organic Honeycrisp Apple Breakfast Bread, Egg Beaters Egg Product, Real, Original, Wegmans Fat Free Milk, Wegmans Pure Vanilla Extract, Wegmans White Sugar, Granulated
https://shop.wegmans.com/recipes/2316/berry-frizzante,Berry Frizzante,Wegmans Mint, Strawberries, Raspberries, Blackberries, Wegmans Frizzante Sicilian Lemon European Soda, Blueberries
https://shop.wegmans.com/recipes/1901/berry-green-smoothie,Berry Green Smoothie,Bananas, Each, Wegmans Vanilla Lowfat Yogurt, Strawberries, Naked Machine Chilled  Juice, Green
https://shop.wegmans.com/recipes/3645/berry-puree,Berry Puree,Blueberries, Strawberries, Wegmans 100% Juice, Apple
https://shop.wegmans.com/recipes/3623/black-bean-cakes,Black Bean Cakes,Wegmans Cilantro, Wegmans Vitamin D Whole Milk, Wegmans Black Beans, Wegmans One Dozen Large Eggs, White Onions, Wegmans Vegetable Oil, Wegmans All Purpose Unbleached Flour, Wegmans Mini Sweet Peppers, FAMILY PACK, Wegmans White Panko Bread Crumbs, Wegmans 100% Mediterranean Blend Olive Oil, Pure
https://shop.wegmans.com/recipes/3883/black-bean-enchiladas,Black Bean Enchiladas,Wegmans Vegetable Oil, Wegmans Organic Caribbean Black Bean Soup, Wegmans Mexican Fancy Shredded Cheeses, Wegmans Red Chile Sauce, Wegmans Black Beans, Wegmans Organic Stoneground Yellow Corn Tortillas, Green Onions (Scallions)
https://shop.wegmans.com/recipes/3270/black-bean-quesadillas,Black Bean Quesadillas,Wegmans Organic Vegetarian Refried Black Beans, Wegmans Chopped Onions, Wegmans Mexican Fancy Shredded Cheese, Wegmans Canola Oil Cooking Spray, Wegmans 100% Mediterranean Blend Olive Oil, Pure, Wegmans Fajita Tortillas, Gordita Style
https://shop.wegmans.com/recipes/349/black-bean-soup,Black Bean Soup,Wegmans Sour Cream, Wegmans Vegetable Oil, Wegmans Chicken Culinary Stock, Wegmans Black Beans, MCCORMICK Ground Cumin, Rotel Diced Tomatoes & Green Chilies, Mild, Wegmans Garlic, Peeled, Fresh Cilantro (Corriander), Wegmans Diced Mirepoix
https://shop.wegmans.com/recipes/3102/blackberry-coulis,Blackberry Coulis,Wegmans White Sugar, Granulated, Large Fresh Limes, Wegmans Frozen Blackberries, Wegmans Premium Orange Juice, No Pulp
https://shop.wegmans.com/recipes/1928/black-garlic-chicken,Black Garlic Chicken,Wegmans Vegetable Oil, Wegmans Dark Brown Sugar, Pure Cane, Organic Black Garlic, Wegmans Sliced Baby Bella Mushrooms, FAMILY PACK, Wegmans Soy Sauce, Wegmans Smoked Paprika, Wegmans Black Pepper, Pure Ground , Wegmans Demi-Glace, Wegmans Organic Whole Chicken Cut In Pieces, Wegmans Fine Crystals Sea Salt, Birds Eye Pearl Onions, White, KONG YEN Vinegar, Black, More Than Gourmet Demi-Glace, Classic French, Demi-Glace Gold
https://shop.wegmans.com/recipes/4431/white-miso-mustard-dressing,White Miso Mustard Dressing,Kikkoman Kotteri Mirin, Wegmans White Sugar, Granulated, Colmans of Norwich Double Superfine Mustard Powder, Original English, Wegmans White Miso Paste, Wegmans 100% Mediterranean Blend Olive Oil, Pure, Wegmans Rice Vinegar
https://shop.wegmans.com/recipes/128/zucchini-mushroom-stir-fry,Zucchini & Mushroom Stir Fry,Fresh Ginger, Green Squash (Zucchini), Wegmans 100% Mediterranean Blend Olive Oil, Pure, Wegmans Vegetarian Oyster Style Sauce, Beech Mushrooms, Greenhouse Grown Red Sweet Peppers
https://shop.wegmans.com/recipes/2618/watermelon-fennel-orange-salad-with-cotija-cheese,Watermelon, Fennel & Orange Salad with Cotija Cheese,Wegmans 100% Mediterranean Blend Olive Oil, Pure, Fresh Ginger, Sole! Cotija Cheese, Wegmans Mint, Wegmans Fresh Cut Watermelon Chunks, FAMILY PACK, Fennel (Anise), Valencia Oranges, Wegmans Spring MIx
https://shop.wegmans.com/recipes/1367/watermelon-feta-fresh-mint,Watermelon, Feta & Fresh Mint,Wegmans Mint, Wegmans Crumbled Feta Cheese- Plain
https://shop.wegmans.com/recipes/2214/watermelon-gazpacho,Watermelon Gazpacho,Fresh Cilantro (Corriander), Pineapple, Extra Sweet, Wegmans Vinegar, Flavor Infused, Raspberry, Orange Habanero Pepper, Maradol Papayas, Wegmans Organic Pure Cane Granulated Sugar
https://shop.wegmans.com/recipes/2478/watermelon-kale-feta-salad,Watermelon, Kale & Feta Salad,Wegmans Crumbled Feta Cheese- Plain, Wegmans Peeled Shallots, Wegmans Mint, Wegmans Italian Classics Organic Organic Glaze with Balsamic Vinegar of Modena, Wegmans Italian Classics Campagnan Extra Virgin Olive Oil, Wegmans Dry Roasted Seasoned Sunflower Kernels, Wegmans Kale Greens
https://shop.wegmans.com/recipes/3809/watermelon-mojito,Watermelon Mojito,Large Fresh Limes, Domino Sugar, Pure Cane, Quick Dissolve Superfine, Wegmans Club Soda, 12 Pack, Wegmans Fresh Cut Mini Watermelon Hearts
https://shop.wegmans.com/recipes/394/white-bean-hummus,White Bean Hummus,Lemons, Wegmans Sicilian Lemon Extra Virgin Olive Oil, Wegmans Cannellini Beans
https://shop.wegmans.com/recipes/1445/white-bean-roasted-tomato-soup,White Bean & Roasted Tomato Soup,Wegmans Vegetable Culinary Stock, Wegmans Roasted Red Tomatoes, Wegmans Chopped Onions, Wegmans Cheese & Garlic Twice-Baked Croutons, Wegmans Uncured Bacon, Applewood Smoked, Moro Formaggi Truffle Sottocenere Cheese, Wegmans Cannellini Beans
https://shop.wegmans.com/recipes/336/white-bean-soup,White Bean Soup,Red Onions, Wegmans Organic Carrots, Wegmans Garlic, Peeled, Wegmans Italian Classics Toscano Extra Virgin Olive Oil, Wegmans 100% Mediterranean Blend Olive Oil, Pure, Celery, Wegmans Italian Parsley, Butter Potato, Wegmans Rosemary, Wegmans Italian Classics Diced Pancetta
https://shop.wegmans.com/recipes/1218/white-bolognese,White Bolognese,Wegmans Garlic, Peeled, Wegmans Rosemary, Wegmans Diced Mirepoix, Wegmans Organic Ground Pork, Wegmans Sage, Italian Parsley, Wegmans 100% Mediterranean Blend Olive Oil, Extra Virgin
https://shop.wegmans.com/recipes/461/white-clam-naan-pizza,White Clam Naan Pizza,Wegmans Traditional Naan, Wegmans Italian Parsley, Wegmans Garlic Cheese Finishing Butter, Wegmans Organic Basting Oil, Northern Chef Clam Meat, Cooked, Wegmans Italian Classics Alfredo Parmesan Cream Sauce, Wegmans Low-Moisture Part-Skim Shredded Mozzarella Cheese
https://shop.wegmans.com/recipes/319/white-onion-soup,White Onion Soup,Wegmans Vive Baguette, Wegmans 100% Mediterranean Blend Olive Oil, Pure, Wegmans Butter, Salted, Sweet Cream, MCCORMICK Bay Leaves, Wegmans Chicken Culinary Stock, White Onions, Wegmans All Purpose Unbleached Flour, Wegmans Milky Mild Blue Cheese Crumbles
https://shop.wegmans.com/recipes/4285/white-peach-riesling-soup-with-honey-creme-fraiche-peach-chips,White Peach Riesling Soup with Honey Creme Fraiche & Peach Chips,Wegmans Clover Honey, Vermont Creamery Creme Fraiche, French-Style, McCormick Gourmet Organic Saigon Cinnamon Sticks, Lemons, Wegmans White Sugar, Granulated, Wegmans Heavy Cream, MCCORMICK Bay Leaves, Valencia Oranges, Wegmans Fine Crystals Sea Salt
https://shop.wegmans.com/recipes/3425/white-sangria,White Sangria,Wegmans Sparkling Water Plain, Pineapple, Extra Sweet, Raspberries, Wegmans White Sugar, Granulated, Large Mangos, Select Peaches, Large Fresh Limes
https://shop.wegmans.com/recipes/668/whole-grain-cherry-almond-cookies,Whole Grain Cherry Almond Cookies,Wegmans White Whole Wheat Unbleached Flour, Wegmans Dark Brown Sugar, Pure Cane, Wegmans Organic Milled Flax Seeds, Wegmans Butter, Unsalted, Sweet Cream, Arm & Hammer Baking Soda, Pure, Solo Almond Paste, Pure, Wegmans Sweetened Dried Cherries, Wegmans Pure Vanilla Extract, Wegmans One Dozen Large Eggs
https://shop.wegmans.com/recipes/1122/whole-grain-cinnamon-oatmeal-fruit-cookies,Whole Grain Cinnamon Oatmeal & Fruit Cookies,Wegmans White Whole Wheat Unbleached Flour, Wegmans Dark Brown Sugar, Pure Cane, Wegmans Organic Milled Flax Seeds, Wegmans One Dozen Large Eggs, Wegmans Pure Vanilla Extract, Wegmans Butter, Unsalted, Sweet Cream, Wegmans Quick Oats, Arm & Hammer Baking Soda, Pure, MCCORMICK Ground Cinnamon
https://shop.wegmans.com/recipes/3762/whole-leaf-caesar-salad,Whole Leaf Caesar Salad,Wegmans Romaine Hearts, Wegmans Tellicherry Black Pepper Adjustable Grinder, Wegmans Organic Black Beans
https://shop.wegmans.com/recipes/4075/whole-wheat-pasta-with-roasted-vegetables,Whole Wheat Pasta with Roasted Vegetables,Wegmans 100% Mediterranean Blend Olive Oil, Pure, Wegmans Garlic, Peeled, Yellow Squash (Goldbar), Wegmans Sliced Baby Bella Mushrooms, Wegmans Baby Spinach, Wegmans Italian Classics Organic Whole Wheat Penne Rigate, Purple Eggplant, Green Squash (Zucchini), Wegmans Yellow Cooking Onions, Greenhouse Grown Red Sweet Peppers, Extra Large Green Peppers, Wegmans Roasted Red Tomatoes, Wegmans Organic Basting Oil
https://shop.wegmans.com/recipes/4271/wild-mushroom-and-gruyere-tartlets,Wild Mushroom and Gruyere Tartlets,Wegmans Gruyere Cheese AGed 4-6 Months, Shredded Mild, Wegmans Heavy Cream, Wegmans Gourmet Blend Crimini, Shiitake & Oyster Mushrooms, Wegmans Chives, Wegmans Organic Basting Oil, Sun-Maid Raisins, California Golden, Wegmans Peeled Shallots, Wegmans Ready To Use Mini Phyllo Pastry Shells
https://shop.wegmans.com/recipes/3866/wild-mushroom-artichoke-ragout-in-puff-pastry,Wild Mushroom & Artichoke Ragout in Puff Pastry,Wegmans Chicken Culinary Stock, Wegmans One Dozen Large Eggs, Wegmans Italian Parsley, Pepperidge Farm Puff Pastry Frozen Sheets Pastry Dough, Wegmans Peeled Shallots, Lemons, Wegmans Heavy Cream, Artichokes, Wegmans Fine Crystals Sea Salt, Wegmans Butter, Salted, Sweet Cream
https://shop.wegmans.com/recipes/1626/wild-mushroom-bisque,Wild Mushroom Bisque,Wegmans Chopped Onions, Wegmans Thyme, Wegmans Vegetable Culinary Stock, Uncle Bens Rice, Enriched, Long Grain, Parboiled/Original, Oyster Mushrooms, Wegmans 100% Mediterranean Blend Olive Oil, Pure, Wegmans Sliced Shiitake Mushrooms
https://shop.wegmans.com/recipes/3089/wild-mushroom-spinach-gruyere-egg-casserole,Wild Mushroom, Spinach & Gruyere Egg Casserole,Wegmans Baby Spinach, Wegmans Vitamin D Whole Milk, Wegmans Chopped Onions, Wegmans Gruyere Cheese AGed 4-6 Months, Shredded Mild, Wegmans Canola Oil Butter Flavor Cooking Spray, Wegmans Vegetable Oil, Wegmans One Dozen Large Eggs, Wegmans Gourmet Blend Crimini, Shiitake & Oyster Mushrooms
https://shop.wegmans.com/recipes/311/wrap-with-ham-asparagus,Wrap with Ham & Asparagus,Wegmans Olive Tapenade Spread, Wegmans Burrito Tortillas, Gordita Style, Wegmans Peppadew Whole Peppers, Wegmans 97% Fat Free Ham
https://shop.wegmans.com/recipes/4325/yam-baby-kale-salad,Yam & Baby Kale Salad,Wegmans Whole Grain Dijon Mustard, Wegmans Organic Baby Kale, FAMILY PACK, Yams
https://shop.wegmans.com/recipes/2947/-yam-good-cabbage-corn-salad,Yam Good Cabbage & Corn Salad,Wegmans Organic Basting Oil, Yams, Wegmans Organic White Balsamic Vinaigrette, Wegmans Tuscan Seasoning Shakr, Savoy Cabbage, Wegmans California Extra Virgin Olive Oil
https://shop.wegmans.com/recipes/1283/yam-gratin-with-gruyere,Yam Gratin with Gruyere,Yams, Wegmans Gruyere Cheese AGed 4-6 Months, Shredded Mild, Wegmans Fine Crystals Sea Salt, Wegmans Canola Oil Cooking Spray
https://shop.wegmans.com/recipes/2790/yam-jicama-mango-salad,Yam Jicama & Mango Salad,Wegmans Apple Cider Vinegar, Lemons, Large Fresh Limes, Yams, Jicama, Fresh Cilantro (Corriander), Wegmans 100% Mediterranean Blend Olive Oil, Pure, Wegmans Fresh Cut  Mango Chunks, Valencia Oranges, MCCORMICK Ground Allspice
https://shop.wegmans.com/recipes/2591/yams-with-balsamic-onions,Yams with Balsamic Onions,Wegmans Italian Classics Organic Balsamic Vinegar of Modena, Yams, Red Onions, Wegmans Organic Basting Oil
https://shop.wegmans.com/recipes/2666/yam-tsimmes,Yam Tsimmes,Wegmans Light Brown Sugar, Parsnips, Turnips, Yams, Wegmans Baby Cut Carrots, Wegmans Chopped Onions, Wegmans Chicken Culinary Stock
https://shop.wegmans.com/recipes/907/yam-waffles,Yam Waffles,KRUSTEAZ Pancake Mix, Complete, Buttermilk, Yams, Wegmans Vegetable Oil, Wegmans Canola Oil Butter Flavor Cooking Spray
https://shop.wegmans.com/recipes/372/zucchini-carpaccio,Zucchini Carpaccio,DELLALO Pine Nuts, Spanish, MCCORMICK Crushed Red Pepper, Wegmans Fine Crystals Sea Salt, Wegmans Italian Classics Burrata Cheese, Wegmans Italian Classics Basil Pesto Sauce, Yellow Squash (Goldbar), Green Squash (Zucchini), Wegmans Confectioners 10-X Powdered Sugar, Pure Cane, Wegmans Italian Classics Campagnan Extra Virgin Olive Oil
https://shop.wegmans.com/recipes/3472/zucchini-corn-cakes,Zucchini & Corn Cakes,Wegmans Oregano, Kikkoman Batter Mix, Tempura, Extra Crispy, Wegmans Black Pepper, Pure Ground , Wegmans One Dozen Large Eggs, Wegmans Fine Crystals Sea Salt, Green Onions (Scallions), Green Squash (Zucchini), Wegmans Vegetable Oil
https://shop.wegmans.com/recipes/2694/zucchini-soup,Zucchini Soup,Wegmans 100% Mediterranean Blend Olive Oil, Pure, Green Squash (Zucchini), Wegmans Garlic, Peeled, Wegmans Chicken Culinary Stock, Wegmans Chopped Onions, Green Onions (Scallions), Fresh Cilantro (Corriander)
https://shop.wegmans.com/recipes/3172/zucchini-sticks-with-garlic-parmesan,Zucchini Sticks with Garlic Parmesan,Wegmans California Extra Virgin Olive Oil, Wegmans Garlic Parmesan Seasoning Shakr, Wegmans Fresh Cut Veggie Spaghetti
https://shop.wegmans.com/recipes/218/zuppa-di-pesce-alla-napoletana,Zuppa di Pesce alla Napoletana,Bar Harbor Clam Juice, Wegmans Garlic, Peeled, Wegmans Italian Parsley, Wegmans Italian Classics San Marzano Tomatoes, Fennel (Anise), MCCORMICK Oregano, Leaves, Wegmans Canadian Organic Mussels, 2 lb. bag, MCCORMICK Crushed Red Pepper, Wegmans Italian Classics Organic Extra Virgin Olive Oil, Wegmans Fresh Wild Caught  Shrimp, Wegmans Basil, Wild Lobster Tail, Cold Water (5-6 oz size)
https://shop.wegmans.com/recipes/2515/zucchini-walnut-bread,Zucchini Walnut Bread,Simply Organic Vanilla Extract, Pure, Wegmans Fine Crystals Sea Salt, SIMPLY ORGANIC Cinnamon, Vietnamese, Wegmans Organic Large Brown Eggs, Pero Family Farms Freshwrap Zucchini, Organic, Wegmans Organic Raw, Halves & Pieces Walnuts, Wegmans Organic Pure Cane Granulated Sugar, Wegmans Organic Raisins, Wegmans Canola Oil Cooking Spray, Arm & Hammer Baking Soda, Pure, Simply Organic Ground Cloves, Spectrum Oil, Sunflower, Organic, Wegmans Baking Powder, Wegmans White Whole Wheat Unbleached Flour